<?xml version="1.0" encoding="UTF-8"?>

<!DOCTYPE homepage [
<!ELEMENT root (worksheet,Row,WEBDEVELOPMENT)>
<!ELEMENT worksheet (#CDATA)>
<ATTLIST worksheet name CDATA #FIXED "Sheet1">
<!ELEMENT Row (#CDATA)>
<<ATTLIST Row index CDATA #REQUIRED>
<!ELEMENT WEBDEVELOPMENT (#CDATA)>
]

<root>
    <worksheet name="Sheet1">
        <Row index="4">
            <WEBDEVELOPMENT>Overview Curriculum Prerequisites Instructor </WEBDEVELOPMENT>
        </Row>
        <Row index="6">
            <WEBDEVELOPMENT>COURSE OVERVIEW</WEBDEVELOPMENT>
        </Row>
        <Row index="8"/>
        <Row index="9">
            <WEBDEVELOPMENT>CURRICULUM</WEBDEVELOPMENT>
        </Row>
        <Row index="12"/>
        <Row index="13">
            <WEBDEVELOPMENT>PREREQUISITES</WEBDEVELOPMENT>
        </Row>
        <Row index="15"/>
        <Row index="16">
            <WEBDEVELOPMENT>INSTRUCTOR</WEBDEVELOPMENT>
        </Row>
        <Row index="18">
            <WEBDEVELOPMENT>Rob Dey</WEBDEVELOPMENT>
        </Row>
        <Row index="19">
            <WEBDEVELOPMENT>-4.0 INSTRUCTOR RATINGS -32789 REVIEWS -25167 STUDENTS -17 COURSES</WEBDEVELOPMENT>
        </Row>
        <Row index="20">
            <WEBDEVELOPMENT>Hello there! I'm Rob Dey and I'm a software engineer with expertise in full-stack (front/back-end) web development. Over the last 10+ years I've built software for Coca-Cola, Toyota, Newell Rubbermaid, Edison Nation, First Data, Bennigan's, and more. I've also founded my own profitable startup. I'm currently developing EdTech software for musicians. </WEBDEVELOPMENT>
        </Row>
    </worksheet>
</root>